{
  "policyId": "29d222ce763455e3d7a09a665ce554f00ac89d2e99a1a83d267170c6",
  "hexName": "4d494e",
  "name": "Minswap",
  "ticker": "MIN",
  "description": "Minswap is a decentralized exchange on Cardano offering multi-pool liquidity, yield farming, and community governance. One of the most actively traded DEXes in the Cardano ecosystem.",
  "website": "https://minswap.org",
  "socials": {
    "twitter": "https://twitter.com/MinswapDEX",
    "discord": "https://discord.gg/minswap",
    "telegram": "https://t.me/MinswapMafia",
    "github": "https://github.com/minswap",
    "medium": "https://medium.com/minswap",
    "reddit": null,
    "youtube": null
  },
  "tags": ["defi"],
  "verified": true
}
