{
  "policyId": "e5a42a1a1d3d1da71b0449663c32798725888d2eb0843c4dabeca05a",
  "hexName": "576f726c644d6f62696c65546f6b656e58",
  "name": "World Mobile Token",
  "ticker": "WMTX",
  "description": "World Mobile is building a decentralized mobile network to connect the unconnected. WMTX is the utility token powering the World Mobile ecosystem on Cardano.",
  "website": "https://worldmobile.io",
  "socials": {
    "twitter": "https://twitter.com/WorldMobileTeam",
    "discord": "https://discord.gg/worldmobile",
    "telegram": "https://t.me/WorldMobileTeam",
    "github": null,
    "medium": null,
    "reddit": null,
    "youtube": null
  },
  "tags": ["utility", "community"],
  "verified": true
}
