{
  "policyId": "a0028f350aaabe0545fdcb56b039bfb08e4bb4d8c4d7c3c7d481c235",
  "hexName": "484f534b59",
  "name": "Hosky Token",
  "ticker": "HOSKY",
  "description": "HOSKY is Cardano's original meme token, embracing the absurdity of crypto culture. A community-driven token with zero utility and maximum meme energy.",
  "website": "https://hosky.io",
  "socials": {
    "twitter": "https://twitter.com/hoskytoken",
    "discord": "https://discord.gg/hosky",
    "telegram": null,
    "github": null,
    "medium": null,
    "reddit": null,
    "youtube": null
  },
  "tags": ["meme", "community"],
  "verified": true
}
