{
  "policyId": "533bb94a8850ee3ccbe483106489399112b74c905342cb1792a797a0",
  "hexName": "494e4459",
  "name": "Indigo Protocol",
  "ticker": "INDY",
  "description": "Indigo Protocol is a decentralized synthetic assets platform on Cardano, enabling users to create and trade synthetic versions of real-world assets like stocks and commodities.",
  "website": "https://indigoprotocol.io",
  "socials": {
    "twitter": "https://twitter.com/IndigoProtocol1",
    "discord": "https://discord.gg/indigo",
    "telegram": null,
    "github": "https://github.com/IndigoProtocol",
    "medium": null,
    "reddit": null,
    "youtube": null
  },
  "tags": ["defi", "governance"],
  "verified": true
}
